title,headline,media,inspiration,what_it_does,how_we_built_it,challenges,accomplishments,lessons,whats_next,built_with,demos
Heat Pump Alliance ,"
    Promoting the adoption of using Heat Smart Alliance to reduce household carbon footprints 
  ","['//d112y698adiu2z.cloudfront.net/photos/production/software_photos/001/823/998/datas/gallery.jpg', '//d112y698adiu2z.cloudfront.net/photos/production/software_photos/001/824/002/datas/gallery.jpg', '//d112y698adiu2z.cloudfront.net/photos/production/software_photos/001/822/792/datas/gallery.jpg', '//d112y698adiu2z.cloudfront.net/photos/production/software_photos/001/822/791/datas/gallery.jpg', '//d112y698adiu2z.cloudfront.net/photos/production/software_photos/001/822/790/datas/gallery.jpg', '//d112y698adiu2z.cloudfront.net/photos/production/software_photos/001/822/788/datas/gallery.jpg', '//d112y698adiu2z.cloudfront.net/photos/production/software_photos/001/822/786/datas/gallery.jpg', '//d112y698adiu2z.cloudfront.net/photos/production/software_photos/001/822/789/datas/gallery.jpg', '//d112y698adiu2z.cloudfront.net/photos/production/software_photos/001/822/785/datas/gallery.jpg', '//d112y698adiu2z.cloudfront.net/photos/production/software_photos/001/822/787/datas/gallery.jpg', 'https://www.youtube.com/embed/q3Y0ZKq2o_0?enablejsapi=1&hl=en_US&rel=0&start=&version=3&wmode=transparent', 'https://d112y698adiu2z.cloudfront.net/photos/production/software_photos/001/823/998/datas/original.png', 'https://d112y698adiu2z.cloudfront.net/photos/production/software_photos/001/824/002/datas/original.png', 'https://d112y698adiu2z.cloudfront.net/photos/production/software_photos/001/822/792/datas/original.png', 'https://d112y698adiu2z.cloudfront.net/photos/production/software_photos/001/822/791/datas/original.png', 'https://d112y698adiu2z.cloudfront.net/photos/production/software_photos/001/822/790/datas/original.png', 'https://d112y698adiu2z.cloudfront.net/photos/production/software_photos/001/822/788/datas/original.png', 'https://d112y698adiu2z.cloudfront.net/photos/production/software_photos/001/822/786/datas/original.png', 'https://d112y698adiu2z.cloudfront.net/photos/production/software_photos/001/822/789/datas/original.png', 'https://d112y698adiu2z.cloudfront.net/photos/production/software_photos/001/822/785/datas/original.png', 'https://d112y698adiu2z.cloudfront.net/photos/production/software_photos/001/822/787/datas/original.png']","Climate change is the term that has been mentioned a lot recently. Because of climate change, warmer temperatures over time are changing weather patterns and disrupting the usual balance of nature. This poses many risks to human beings and all other forms of life on Earth. The causes for climate change are because of pollution, carbon emission, green house gas emission, etc. With the thought to reduce the amount of carbon and green house gas emission to save the earth, we would like to help Heat Smart Alliance to reach to more people and speed up their work through developing technology aided coaching, digitalization of existing customer journey, and expand the reach to more MA communities. ",,,,,,,"['artificial-intelligent', 'css', 'google-cloud', 'html5', 'javascript', 'machine-learning']","['https://gallant-wiles-d03b58.netlify.app/home.html', 'https://github.com/darshantogadiya/deisHack2022']"
Nurture,"
    Automated Artificial Environment Chamber
  ","['//d112y698adiu2z.cloudfront.net/photos/production/software_photos/001/823/287/datas/gallery.jpg', '//d112y698adiu2z.cloudfront.net/photos/production/software_photos/001/823/295/datas/gallery.jpg', '//d112y698adiu2z.cloudfront.net/photos/production/software_photos/001/823/296/datas/gallery.jpg', '//d112y698adiu2z.cloudfront.net/photos/production/software_photos/001/823/302/datas/gallery.jpg', '//d112y698adiu2z.cloudfront.net/photos/production/software_photos/001/823/310/datas/gallery.jpg', '//d112y698adiu2z.cloudfront.net/photos/production/software_photos/001/823/420/datas/gallery.jpg', '//d112y698adiu2z.cloudfront.net/photos/production/software_photos/001/823/425/datas/gallery.jpg', '//d112y698adiu2z.cloudfront.net/photos/production/software_photos/001/823/604/datas/gallery.jpg', '//d112y698adiu2z.cloudfront.net/photos/production/software_photos/001/823/581/datas/gallery.jpg', '//d112y698adiu2z.cloudfront.net/photos/production/software_photos/001/823/714/datas/gallery.jpg', 'https://www.youtube.com/embed/N91eIB1B_JQ?enablejsapi=1&hl=en_US&rel=0&start=&version=3&wmode=transparent', 'https://d112y698adiu2z.cloudfront.net/photos/production/software_photos/001/823/287/datas/original.jpg', 'https://d112y698adiu2z.cloudfront.net/photos/production/software_photos/001/823/295/datas/original.jpg', 'https://d112y698adiu2z.cloudfront.net/photos/production/software_photos/001/823/296/datas/original.jpg', 'https://d112y698adiu2z.cloudfront.net/photos/production/software_photos/001/823/302/datas/original.jpg', 'https://d112y698adiu2z.cloudfront.net/photos/production/software_photos/001/823/310/datas/original.jpg', 'https://d112y698adiu2z.cloudfront.net/photos/production/software_photos/001/823/420/datas/original.png', 'https://d112y698adiu2z.cloudfront.net/photos/production/software_photos/001/823/425/datas/original.png', 'https://d112y698adiu2z.cloudfront.net/photos/production/software_photos/001/823/604/datas/original.png', 'https://d112y698adiu2z.cloudfront.net/photos/production/software_photos/001/823/581/datas/original.png', 'https://d112y698adiu2z.cloudfront.net/photos/production/software_photos/001/823/714/datas/original.png']",The fondness towards gardening and plant growth in artificial environment or similar like poultry incubator was a major motivation behind our idea of building Nurture. We wanted to build a feasible and versatile solution with a comparatively easier user interface that can be used by everyone and not only laboratories or industries. ,,Here we are showing nurture to monitor the parameters for a plant that will produce artificially controlled environments crucial for its growth and seed germination in any environment. We used MQTT for the messaging part and we used motor pump to automatically water the plant and a bulb to warm the environment. Used an ESP32 to connect to the WiFi and ran RTOS on it to run the functions.,,,,,"['akiro', 'esp32', 'hardware', 'iot', 'oled', 'rtos', 'sensors']",['https://github.com/Deblina28/Nurture']
Corporate Social Responsibility In-Kind Database,"
    Our team created a dynamic database for the Haven Project with over 40 resources for in-kind donations to diversify value, assets, and increase accessibility to resources.
  ","['//d112y698adiu2z.cloudfront.net/photos/production/software_photos/001/821/724/datas/gallery.jpg', '//d112y698adiu2z.cloudfront.net/photos/production/software_photos/001/821/728/datas/gallery.jpg', 'https://www.youtube.com/embed/ras6rtG5wb8?enablejsapi=1&hl=en_US&rel=0&start=&version=3&wmode=transparent', 'https://d112y698adiu2z.cloudfront.net/photos/production/software_photos/001/821/724/datas/original.png', 'https://d112y698adiu2z.cloudfront.net/photos/production/software_photos/001/821/728/datas/original.png']","Our team observed that like many other Non-Profit organizations, the Haven Project relies on donations and grants to access the resources needed to serve their mission. Our team wanted to find a way to help Haven access a more diversified set of resources.","The clothing category includes resources for clothing donations, and the toiletries category includes resources for toiletry donations. Auction donations lists companies that will donate high-demand items that can be auctioned by the non-profit for fundraising, and the meals & vouchers include resources for meal vouchers, food donations, and restaurant gift cards. Local grants lists companies that give small grants to nonprofits through the company’s local branches, and job resources lists available resources to assist in building workforce skills or finding apprenticeship opportunities. We believe these categories will help the Haven Project access a plethora of resources to serve their clients. ","During research, we learned about Corporate Social Responsibility and In-Kind donations. We saw great potential for connecting these resources with the Haven Project. Through Corporate Social Responsibility programs, many large corporations give various types of donations to local nonprofits other than money. We learned that these are called “in-kind donations”. Our team decided we wanted to find a way to make it easy for the Haven Project to access the many in-kind donations that are available. Our team worked on gathering information about over 40 companies that participate in Corporate Social Responsibility programs. We created a database that listed the company names, the type of donations they make, descriptions of the donations, and all necessary steps to apply for and receive the donation. We filtered the donations by type so that the Haven Project can easily select which category of available donations they would like to view. The categories include clothing, meals & vouchers, auction donations, local grants, toiletries, and job resources. We implemented our database into a website using Wix website builder. All information from the database is accessible on the website. ","The largest challenge our team faced occurred when one of our team members exited the group fairly late into the event. This member had the most coding experience, and left us with a complicated and unfinished website. Our team had to ideate a way to build an effective web interface with limited coding skills and limited time. We started the website from scratch, deserting the previous interface we had spent many hours working on. We quickly found creative ways to work with a website builder, and implemented fast research to learn how to transfer our database into the website builder.",All of our determination and willingness to persevere has led us to our finished product. We have created a user-friendly and effective web interface that the Haven Project can use to access all of the resources we spent time researching. ,"Through determination, effective team-work, and creative problem solving, daunting challenges can be overcome. ","Our team intends for this database to continue to be updated and expanded as further research is conducted. In the future, our team envisions a function that would allow donors to visit the database and register their own resource offerings to the database. ","['csv', 'excel', 'wix']",['https://pearovsocks2.wixsite.com/my-site']
Digital Marketing for Donor Engagement Hack,"
    We've delivered an easy to implement marketing strategy for The Haven Project that focuses on engaging donors. This marketing strategy focuses on establishing a brand and leveraging impact data. 
  ",['https://www.youtube.com/embed/r5EHBMZIpY4?enablejsapi=1&hl=en_US&rel=0&start=&version=3&wmode=transparent'],We were heavily inspired about our past experiences in marketing strategies with our team consulting projects which were for the same company. We were able to call back on the skills we gained in data analysis and marketing/brand awareness strategies from that experience.,This hack provides a template and implementable guides on establishing a brand and leveraging impact data.,We used Miro to create the guide and Venngage for the dashboard.,,,"This taught us how to brainstorm in a rapid manner and create a bumper-sticker pitch for an entire plan, which takes a considerable amount of patience and compromising.",We hope to take the stamina and skills we built for this Hackathon and use it for similar future ventures. We hope The Haven Project will be able to consider our project as a viable solution.,"['miro', 'venngage']",
Waltham Rotary Club: Membership Growth Solution,"
    We developed a contest to help solve the Waltham Rotary Club's membership growth. The contests offers students the opportunity to gain project planning experience and connect them with the Rotary Club
  ",['https://www.youtube.com/embed/9qy787XG3KQ?enablejsapi=1&hl=en_US&rel=0&start=&version=3&wmode=transparent'],,Addresses Waltham Rotary Club's struggles with younger membership. ,,,,,The next steps are getting the contest approved so it can happen in the fall!,['powerpoint'],
